{
  "drift_report_version": "1.1",
  "run_id": "run-20260929T161927Z",
  "at_utc": "2026-09-29T16:19:27+00:00",
  "season": 2026,
  "week": 4,
  "model_version": "20260911-asof_v1-d333de20",
  "window_weeks_max": 4,
  "status": "warn",
  "positions": {
    "QB": {
      "n": 151,
      "psi": {
        "fantasy_points_ppr_L3_avg": 0.1171,
        "fantasy_points_ppr_L5_avg": 0.1298,
        "passing_yards_L5_avg": 0.2489,
        "passing_yards_L3_avg": 0.2516,
        "passing_air_yards_L3_avg": 0.2978,
        "passing_yards_L1": 0.2238,
        "fantasy_points_ppr_L1": 0.1528
      },
      "monitored": [
        "fantasy_points_ppr_L3_avg",
        "fantasy_points_ppr_L5_avg",
        "passing_yards_L5_avg",
        "passing_yards_L3_avg",
        "passing_air_yards_L3_avg",
        "passing_yards_L1",
        "fantasy_points_ppr_L1"
      ],
      "median_monitored": 0.2238,
      "flagged": [
        "passing_air_yards_L3_avg",
        "passing_yards_L3_avg"
      ],
      "severe": [],
      "thresholds": {
        "warn": 0.1,
        "hold_median": 0.25,
        "severe": 0.5,
        "min_severe_features": 2
      },
      "status": "warn",
      "reference": {
        "mode": "matched",
        "window_seasons": [
          2025,
          2026
        ],
        "window_weeks": [
          18,
          1,
          2,
          3
        ],
        "reference_weeks": [
          1,
          2,
          3,
          18
        ],
        "training_seasons": [
          2019,
          2020,
          2021,
          2022
        ],
        "n_reference_rows": 455
      }
    },
    "RB": {
      "n": 346,
      "psi": {
        "fantasy_points_ppr_L5_avg": 0.0681,
        "carries_L3_avg": 0.0243,
        "carries_L1": 0.1232,
        "carries_L5_avg": 0.0377,
        "fantasy_points_ppr_L3_avg": 0.0529,
        "rushing_yards_L1": 0.1869,
        "rushing_yards_L5_avg": 0.0661,
        "fantasy_points_ppr_L1": 0.3502
      },
      "monitored": [
        "fantasy_points_ppr_L5_avg",
        "carries_L3_avg",
        "carries_L1",
        "carries_L5_avg",
        "fantasy_points_ppr_L3_avg",
        "rushing_yards_L1",
        "rushing_yards_L5_avg",
        "fantasy_points_ppr_L1"
      ],
      "median_monitored": 0.0671,
      "flagged": [
        "fantasy_points_ppr_L1"
      ],
      "severe": [],
      "thresholds": {
        "warn": 0.1,
        "hold_median": 0.25,
        "severe": 0.5,
        "min_severe_features": 2
      },
      "status": "warn",
      "reference": {
        "mode": "matched",
        "window_seasons": [
          2025,
          2026
        ],
        "window_weeks": [
          18,
          1,
          2,
          3
        ],
        "reference_weeks": [
          1,
          2,
          3,
          18
        ],
        "training_seasons": [
          2019,
          2020,
          2021,
          2022
        ],
        "n_reference_rows": 1106
      }
    },
    "WR": {
      "n": 563,
      "psi": {
        "targets_L5_avg": 0.1237,
        "fantasy_points_ppr_L5_avg": 0.0983,
        "receptions_L5_avg": 0.1574,
        "receiving_yards_L5_avg": 0.0974,
        "fantasy_points_ppr_L3_avg": 0.1349,
        "receiving_air_yards_L3_avg": 0.0715
      },
      "monitored": [
        "targets_L5_avg",
        "fantasy_points_ppr_L5_avg",
        "receptions_L5_avg",
        "receiving_yards_L5_avg",
        "fantasy_points_ppr_L3_avg",
        "receiving_air_yards_L3_avg"
      ],
      "median_monitored": 0.111,
      "flagged": [],
      "severe": [],
      "thresholds": {
        "warn": 0.1,
        "hold_median": 0.25,
        "severe": 0.5,
        "min_severe_features": 2
      },
      "status": "warn",
      "reference": {
        "mode": "matched",
        "window_seasons": [
          2025,
          2026
        ],
        "window_weeks": [
          18,
          1,
          2,
          3
        ],
        "reference_weeks": [
          1,
          2,
          3,
          18
        ],
        "training_seasons": [
          2019,
          2020,
          2021,
          2022
        ],
        "n_reference_rows": 1751
      }
    },
    "TE": {
      "n": 295,
      "psi": {
        "fantasy_points_ppr_L5_avg": 0.0698,
        "targets_L5_avg": 0.1321,
        "receiving_yards_L5_avg": 0.0735,
        "receiving_yards_L3_avg": 0.039,
        "fantasy_points_ppr_L3_avg": 0.07,
        "targets_L3_avg": 1.294
      },
      "monitored": [
        "fantasy_points_ppr_L5_avg",
        "targets_L5_avg",
        "receiving_yards_L5_avg",
        "receiving_yards_L3_avg",
        "fantasy_points_ppr_L3_avg",
        "targets_L3_avg"
      ],
      "median_monitored": 0.0717,
      "flagged": [
        "targets_L3_avg"
      ],
      "severe": [
        "targets_L3_avg"
      ],
      "thresholds": {
        "warn": 0.1,
        "hold_median": 0.25,
        "severe": 0.5,
        "min_severe_features": 2
      },
      "status": "warn",
      "reference": {
        "mode": "matched",
        "window_seasons": [
          2025,
          2026
        ],
        "window_weeks": [
          18,
          1,
          2,
          3
        ],
        "reference_weeks": [
          1,
          2,
          3,
          18
        ],
        "training_seasons": [
          2019,
          2020,
          2021,
          2022
        ],
        "n_reference_rows": 840
      }
    }
  }
}
