{
  "drift_report_version": "1.1",
  "run_id": "run-20261027T154142Z",
  "at_utc": "2026-10-27T15:41:42+00:00",
  "season": 2026,
  "week": 8,
  "model_version": "20260911-asof_v1-d333de20",
  "window_weeks_max": 4,
  "status": "warn",
  "positions": {
    "QB": {
      "n": 128,
      "psi": {
        "passing_yards_L1": 0.0889,
        "passing_yards_L3_avg": 0.2034,
        "passing_yards_L5_avg": 0.3076,
        "passing_yards_season_avg": 0.1993,
        "passing_tds_L1": 0.3151,
        "passing_tds_L3_avg": 0.1822,
        "passing_tds_L5_avg": 0.2324,
        "passing_tds_season_avg": 0.145,
        "rushing_yards_L1": 0.2857,
        "rushing_yards_L3_avg": 0.3102,
        "rushing_yards_L5_avg": 0.2579,
        "rushing_yards_season_avg": 0.1152,
        "rushing_tds_L1": 0.0105,
        "rushing_tds_L3_avg": 0.0421,
        "rushing_tds_L5_avg": 0.075,
        "rushing_tds_season_avg": 0.0277,
        "fantasy_points_ppr_L1": 0.1652,
        "fantasy_points_ppr_L3_avg": 0.148,
        "fantasy_points_ppr_L5_avg": 0.2021,
        "fantasy_points_ppr_season_avg": 0.1394,
        "attempts_L1": 0.1845,
        "attempts_L3_avg": 0.1036,
        "attempts_L5_avg": 0.2897,
        "attempts_season_avg": 0.261,
        "completions_L1": 0.2059,
        "completions_L3_avg": 0.147,
        "completions_L5_avg": 0.3659,
        "completions_season_avg": 0.3018,
        "carries_L1": 1.406,
        "carries_L3_avg": 0.1193,
        "carries_L5_avg": 0.3728,
        "carries_season_avg": 0.1575,
        "passing_interceptions_L1": 0.0493,
        "passing_interceptions_L3_avg": 0.0542,
        "passing_interceptions_L5_avg": 1.2865,
        "passing_interceptions_season_avg": 0.2546,
        "passing_air_yards_L1": 0.1872,
        "passing_air_yards_L3_avg": 0.0647,
        "passing_air_yards_L5_avg": 0.1609,
        "passing_air_yards_season_avg": 0.1312,
        "completion_pct_L3": 0.1334,
        "yards_per_carry_L3": 0.2041,
        "week_of_season": 0.2319,
        "games_played_prior": 0.3367
      },
      "monitored": [
        "fantasy_points_ppr_L3_avg",
        "fantasy_points_ppr_L5_avg",
        "passing_yards_L5_avg",
        "passing_yards_L3_avg",
        "passing_air_yards_L3_avg",
        "passing_yards_L1",
        "fantasy_points_ppr_L1"
      ],
      "median_monitored": 0.1652,
      "flagged": [
        "passing_yards_L5_avg"
      ],
      "severe": [],
      "thresholds": {
        "warn": 0.1,
        "hold_median": 0.25,
        "severe": 0.5,
        "min_severe_features": 2
      },
      "status": "warn",
      "reference": {
        "mode": "bucket",
        "window_seasons": [
          2026
        ],
        "window_weeks": [
          4,
          5,
          6,
          7
        ],
        "reference_weeks": [
          5,
          6,
          7,
          8
        ],
        "bucket": 1,
        "training_seasons": [
          2019,
          2020,
          2021,
          2022
        ],
        "n_reference_rows": null,
        "fallback": null
      }
    },
    "RB": {
      "n": 331,
      "psi": {
        "rushing_yards_L1": 0.2179,
        "rushing_yards_L3_avg": 0.0467,
        "rushing_yards_L5_avg": 0.0759,
        "rushing_yards_season_avg": 0.5444,
        "rushing_tds_L1": 0.0008,
        "rushing_tds_L3_avg": 0.0771,
        "rushing_tds_L5_avg": 0.3008,
        "rushing_tds_season_avg": 0.1794,
        "receiving_yards_L1": 0.1582,
        "receiving_yards_L3_avg": 0.3273,
        "receiving_yards_L5_avg": 0.3949,
        "receiving_yards_season_avg": 0.4622,
        "receiving_tds_L1": 0.0,
        "receiving_tds_L3_avg": 0.0167,
        "receiving_tds_L5_avg": 0.0042,
        "receiving_tds_season_avg": 0.0122,
        "receptions_L1": 0.0405,
        "receptions_L3_avg": 0.0463,
        "receptions_L5_avg": 0.0649,
        "receptions_season_avg": 0.1092,
        "targets_L1": 0.0302,
        "targets_L3_avg": 0.1071,
        "targets_L5_avg": 0.1065,
        "targets_season_avg": 0.0506,
        "fantasy_points_ppr_L1": 0.2605,
        "fantasy_points_ppr_L3_avg": 0.0798,
        "fantasy_points_ppr_L5_avg": 0.1107,
        "fantasy_points_ppr_season_avg": 0.148,
        "carries_L1": 0.0843,
        "carries_L3_avg": 0.0746,
        "carries_L5_avg": 0.0613,
        "carries_season_avg": 0.0788,
        "receiving_air_yards_L1": 0.1146,
        "receiving_air_yards_L3_avg": 0.2735,
        "receiving_air_yards_L5_avg": 0.3506,
        "receiving_air_yards_season_avg": 0.4854,
        "yards_per_carry_L3": 0.0637,
        "catch_rate_L3": 0.0242,
        "week_of_season": 0.352,
        "games_played_prior": 0.2945
      },
      "monitored": [
        "fantasy_points_ppr_L5_avg",
        "carries_L3_avg",
        "carries_L1",
        "carries_L5_avg",
        "fantasy_points_ppr_L3_avg",
        "rushing_yards_L1",
        "rushing_yards_L5_avg",
        "fantasy_points_ppr_L1"
      ],
      "median_monitored": 0.082,
      "flagged": [
        "fantasy_points_ppr_L1"
      ],
      "severe": [],
      "thresholds": {
        "warn": 0.1,
        "hold_median": 0.25,
        "severe": 0.5,
        "min_severe_features": 2
      },
      "status": "warn",
      "reference": {
        "mode": "bucket",
        "window_seasons": [
          2026
        ],
        "window_weeks": [
          4,
          5,
          6,
          7
        ],
        "reference_weeks": [
          5,
          6,
          7,
          8
        ],
        "bucket": 1,
        "training_seasons": [
          2019,
          2020,
          2021,
          2022
        ],
        "n_reference_rows": null,
        "fallback": null
      }
    },
    "WR": {
      "n": 541,
      "psi": {
        "receiving_yards_L1": 0.4029,
        "receiving_yards_L3_avg": 0.0534,
        "receiving_yards_L5_avg": 0.0929,
        "receiving_yards_season_avg": 0.6602,
        "receiving_tds_L1": 0.035,
        "receiving_tds_L3_avg": 0.0236,
        "receiving_tds_L5_avg": 0.2882,
        "receiving_tds_season_avg": 0.1189,
        "receptions_L1": 0.1078,
        "receptions_L3_avg": 0.1278,
        "receptions_L5_avg": 0.0608,
        "receptions_season_avg": 0.0771,
        "targets_L1": 0.0615,
        "targets_L3_avg": 0.0839,
        "targets_L5_avg": 0.1015,
        "targets_season_avg": 0.0533,
        "fantasy_points_ppr_L1": 0.535,
        "fantasy_points_ppr_L3_avg": 0.096,
        "fantasy_points_ppr_L5_avg": 0.1093,
        "fantasy_points_ppr_season_avg": 0.1098,
        "receiving_air_yards_L1": 0.2689,
        "receiving_air_yards_L3_avg": 0.0294,
        "receiving_air_yards_L5_avg": 0.0469,
        "receiving_air_yards_season_avg": 0.0588,
        "catch_rate_L3": 0.0802,
        "week_of_season": 0.2234,
        "games_played_prior": 0.2575
      },
      "monitored": [
        "targets_L5_avg",
        "fantasy_points_ppr_L5_avg",
        "receptions_L5_avg",
        "receiving_yards_L5_avg",
        "fantasy_points_ppr_L3_avg",
        "receiving_air_yards_L3_avg"
      ],
      "median_monitored": 0.0944,
      "flagged": [],
      "severe": [],
      "thresholds": {
        "warn": 0.1,
        "hold_median": 0.25,
        "severe": 0.5,
        "min_severe_features": 2
      },
      "status": "ok",
      "reference": {
        "mode": "bucket",
        "window_seasons": [
          2026
        ],
        "window_weeks": [
          4,
          5,
          6,
          7
        ],
        "reference_weeks": [
          5,
          6,
          7,
          8
        ],
        "bucket": 1,
        "training_seasons": [
          2019,
          2020,
          2021,
          2022
        ],
        "n_reference_rows": null,
        "fallback": null
      }
    },
    "TE": {
      "n": 302,
      "psi": {
        "receiving_yards_L1": 0.3667,
        "receiving_yards_L3_avg": 0.0406,
        "receiving_yards_L5_avg": 0.0629,
        "receiving_yards_season_avg": 0.0589,
        "receiving_tds_L1": 0.0346,
        "receiving_tds_L3_avg": 0.0297,
        "receiving_tds_L5_avg": 0.0662,
        "receiving_tds_season_avg": 0.077,
        "receptions_L1": 0.074,
        "receptions_L3_avg": 0.0244,
        "receptions_L5_avg": 0.1509,
        "receptions_season_avg": 0.2473,
        "targets_L1": 0.0498,
        "targets_L3_avg": 0.1537,
        "targets_L5_avg": 0.1629,
        "targets_season_avg": 0.1569,
        "fantasy_points_ppr_L1": 1.3628,
        "fantasy_points_ppr_L3_avg": 0.072,
        "fantasy_points_ppr_L5_avg": 0.0843,
        "fantasy_points_ppr_season_avg": 0.0879,
        "receiving_air_yards_L1": 0.0814,
        "receiving_air_yards_L3_avg": 0.1197,
        "receiving_air_yards_L5_avg": 0.1708,
        "receiving_air_yards_season_avg": 0.1795,
        "catch_rate_L3": 0.1519,
        "week_of_season": 0.2493,
        "games_played_prior": 1.4715
      },
      "monitored": [
        "fantasy_points_ppr_L5_avg",
        "targets_L5_avg",
        "receiving_yards_L5_avg",
        "receiving_yards_L3_avg",
        "fantasy_points_ppr_L3_avg",
        "targets_L3_avg"
      ],
      "median_monitored": 0.0781,
      "flagged": [],
      "severe": [],
      "thresholds": {
        "warn": 0.1,
        "hold_median": 0.25,
        "severe": 0.5,
        "min_severe_features": 2
      },
      "status": "ok",
      "reference": {
        "mode": "bucket",
        "window_seasons": [
          2026
        ],
        "window_weeks": [
          4,
          5,
          6,
          7
        ],
        "reference_weeks": [
          5,
          6,
          7,
          8
        ],
        "bucket": 1,
        "training_seasons": [
          2019,
          2020,
          2021,
          2022
        ],
        "n_reference_rows": null,
        "fallback": null
      }
    }
  }
}
